{
  "acceptance_criteria": [
    "Complete assigned work units"
  ],
  "action_id": "ACT-6588a7732f13f6ecbb28",
  "allowed_edit_roots": [],
  "capabilities": [],
  "checkpoint_policy": [
    "after_discovery",
    "after_each_batch",
    "before_blocker"
  ],
  "checkpoint_sha256": null,
  "contract_revision": 2,
  "created_at": "2026-07-09T15:05:57.477578Z",
  "dispatch_id": "DSP-27d4b135a0c9c8bb47d0",
  "estimated_minutes": 60,
  "job_id": "J008",
  "last_progress_at": null,
  "nonce": "NONCE-3ac486ac4fcdb56d6bd3",
  "prohibited_actions": [
    "Do not begin later workflow nodes"
  ],
  "protocol_sha256": "525bf5390a8baa9783cdfb6b486a642bf9c7658d195a450816ae9b27b59e13e4",
  "recovery_check": "Inspect workspace changes and checkpoint before retry",
  "required_checks": [
    "Validate produced artifacts"
  ],
  "result": {
    "acceptance_evidence": [
      "All 49 tasks marked complete in tasks.md"
    ],
    "artifacts": [
      {
        "path": "report.md",
        "purpose": "worker report",
        "sha256": "e2b779070717539dd988ea2bb7a015e78e50e78d9c45e8873c66c535cae1aa94"
      },
      {
        "path": "checkpoint.md",
        "purpose": "current checkpoint",
        "sha256": "b666f9e0e4d3d65f27e4a1e8bb06b9a0e51d53b33ec386b6f034f5a15a370e72"
      },
      {
        "path": "progress.json",
        "purpose": "machine-readable progress",
        "sha256": "c34705e74483bcf4405efecbe00cc5160c3dd0da941cadb15060c69f1a36bd6c"
      }
    ],
    "blocking_issues": [],
    "checkpoint_sha256": "b666f9e0e4d3d65f27e4a1e8bb06b9a0e51d53b33ec386b6f034f5a15a370e72",
    "completed_work_units": [
      "openspec-apply-change"
    ],
    "created_at": "2026-07-09T16:30:19.822593Z",
    "dispatch_id": "DSP-27d4b135a0c9c8bb47d0",
    "improvement_observations": [],
    "nonce": "NONCE-3ac486ac4fcdb56d6bd3",
    "proposed_jobs": [],
    "schema_version": 3,
    "status": "completed",
    "summary": "Applied all visual-effects-03 tasks"
  },
  "schema_version": 3,
  "session_id": "opencode-session-J008",
  "side_effect_class": "workspace_write",
  "started_at": null,
  "status": "resolved",
  "transport": {},
  "unbounded_override": null,
  "work_units": [
    "openspec-apply-change"
  ],
  "workflow_node_id": "apply",
  "workspace": "C:\\Projects\\BlackholeSim"
}
