{
  "acceptance_criteria": [
    "Delta specs merged into main specs"
  ],
  "action_id": "ACT-c23113fffba20a2c20bf",
  "allowed_edit_roots": [
    "C:\\Projects\\BlackholeSim"
  ],
  "capabilities": [],
  "checkpoint_policy": [
    "after_discovery",
    "after_each_batch"
  ],
  "checkpoint_sha256": null,
  "contract_revision": 1,
  "created_at": "2026-07-09T20:54:22.593599Z",
  "dispatch_id": "DSP-8586679f8a2dcad036e1",
  "estimated_minutes": 60,
  "job_id": "J003",
  "last_progress_at": null,
  "nonce": "NONCE-d8725ae4105a64ccacb7",
  "prohibited_actions": [
    "Do not begin later workflow nodes"
  ],
  "protocol_sha256": "be41cdf4f05fc94d330f63b3d9139fe3254e912ab0d983d3b450850018c8486e",
  "recovery_check": "specs_synced",
  "required_checks": [
    "Validate produced artifacts"
  ],
  "result": {
    "acceptance_evidence": [
      "Delta specs merged to main"
    ],
    "artifacts": [
      {
        "path": "report.md",
        "purpose": "worker report",
        "sha256": "bd9827920b6cc5dfccd5f30d0e3689820452d41d2008cf37a573716b1e2a6ef2"
      },
      {
        "path": "checkpoint.md",
        "purpose": "current checkpoint",
        "sha256": "2cc402de69ca68508c2bc6fb682b0fd811e3c2d45e8b42e7871490cfee591adf"
      },
      {
        "path": "progress.json",
        "purpose": "machine-readable progress",
        "sha256": "40777bed715eac691d395419ee9bd613d107e974efc877414c7da8bab292d24d"
      }
    ],
    "blocking_issues": [],
    "checkpoint_sha256": "2cc402de69ca68508c2bc6fb682b0fd811e3c2d45e8b42e7871490cfee591adf",
    "completed_work_units": [
      "sync"
    ],
    "created_at": "2026-07-09T20:56:38.232202Z",
    "dispatch_id": "DSP-8586679f8a2dcad036e1",
    "improvement_observations": [],
    "nonce": "NONCE-d8725ae4105a64ccacb7",
    "proposed_jobs": [],
    "schema_version": 3,
    "status": "completed",
    "summary": "Specs synced"
  },
  "schema_version": 3,
  "session_id": "ses_bootstrap_J003",
  "side_effect_class": "workspace_write",
  "started_at": null,
  "status": "resolved",
  "transport": {},
  "unbounded_override": null,
  "work_units": [
    "sync"
  ],
  "workflow_node_id": "sync-specs",
  "workspace": "C:\\Projects\\BlackholeSim"
}
