{
  "acceptance_criteria": [
    "Changes committed and pushed"
  ],
  "action_id": "ACT-08c9cfa0621a22b3b6f5",
  "allowed_edit_roots": [
    "C:\\Projects\\BlackholeSim"
  ],
  "capabilities": [],
  "checkpoint_policy": [
    "after_discovery",
    "after_each_batch"
  ],
  "checkpoint_sha256": null,
  "contract_revision": 1,
  "created_at": "2026-07-09T20:59:50.771499Z",
  "dispatch_id": "DSP-17b584c7c4aa7fd6cb1f",
  "estimated_minutes": 60,
  "job_id": "J003",
  "last_progress_at": null,
  "nonce": "NONCE-48ae2194e56cfd79e842",
  "prohibited_actions": [
    "Do not begin later workflow nodes"
  ],
  "protocol_sha256": "be41cdf4f05fc94d330f63b3d9139fe3254e912ab0d983d3b450850018c8486e",
  "recovery_check": "commit_pushed",
  "required_checks": [
    "Validate produced artifacts"
  ],
  "schema_version": 3,
  "session_id": "ses_bootstrap_J003",
  "side_effect_class": "repository",
  "started_at": null,
  "status": "recorded",
  "transport": {},
  "unbounded_override": null,
  "work_units": [
    "commit"
  ],
  "workflow_node_id": "commit-push",
  "workspace": "C:\\Projects\\BlackholeSim"
}
