{
  "acceptance_criteria": [
    "Verification completes with findings list"
  ],
  "action_id": "ACT-6804fbfce31bddf8d7d8",
  "allowed_edit_roots": [
    "C:\\Projects\\BlackholeSim"
  ],
  "capabilities": [],
  "checkpoint_policy": [
    "after_discovery",
    "after_each_batch"
  ],
  "checkpoint_sha256": null,
  "contract_revision": 1,
  "created_at": "2026-07-09T20:07:59.260255Z",
  "dispatch_id": "DSP-a6b62540f54c01aeaa87",
  "estimated_minutes": 60,
  "job_id": "J001",
  "last_progress_at": null,
  "nonce": "NONCE-7c375702405c5dee8669",
  "prohibited_actions": [
    "Do not begin later workflow nodes"
  ],
  "protocol_sha256": "be41cdf4f05fc94d330f63b3d9139fe3254e912ab0d983d3b450850018c8486e",
  "recovery_check": "verify_change_exists",
  "required_checks": [
    "Validate produced artifacts"
  ],
  "result": {
    "acceptance_evidence": [
      "Verification findings documented"
    ],
    "artifacts": [
      {
        "path": "report.md",
        "purpose": "worker report",
        "sha256": "b59233fa217314b931c2ceee4d77c4fe794f8c9aefb150a9966407090400389e"
      },
      {
        "path": "checkpoint.md",
        "purpose": "current checkpoint",
        "sha256": "4be69307c6d14528d762b8ff8594c4a82b2dc7755281e988e8c55820cde8c216"
      },
      {
        "path": "progress.json",
        "purpose": "machine-readable progress",
        "sha256": "5c97d5ea38f30724d6c874e0e347ce758783d5999a0d65961b6f0053939f57d9"
      }
    ],
    "blocking_issues": [],
    "checkpoint_sha256": "4be69307c6d14528d762b8ff8594c4a82b2dc7755281e988e8c55820cde8c216",
    "completed_work_units": [
      "verify-change"
    ],
    "created_at": "2026-07-09T20:16:11.218671Z",
    "dispatch_id": "DSP-a6b62540f54c01aeaa87",
    "improvement_observations": [],
    "nonce": "NONCE-7c375702405c5dee8669",
    "proposed_jobs": [],
    "schema_version": 3,
    "status": "completed",
    "summary": "Verification complete: all 49 tasks completed. Implementation matches specs with minor deviations: temperature-to-color mapping not in shader, merger flash intensity scaling linear, scrubbing does not pause simulation."
  },
  "schema_version": 3,
  "session_id": "ses_bootstrap_J001",
  "side_effect_class": "read_only",
  "started_at": null,
  "status": "resolved",
  "transport": {},
  "unbounded_override": null,
  "work_units": [
    "verify-change"
  ],
  "workflow_node_id": "verify",
  "workspace": "C:\\Projects\\BlackholeSim"
}
