{
  "acceptance_criteria": [
    "All findings fixed",
    "Code compiles"
  ],
  "action_id": "ACT-79f8cf04f25137056556",
  "allowed_edit_roots": [
    "C:\\Projects\\BlackholeSim"
  ],
  "capabilities": [],
  "checkpoint_policy": [
    "after_discovery",
    "after_each_batch"
  ],
  "checkpoint_sha256": null,
  "contract_revision": 1,
  "created_at": "2026-07-09T20:19:16.486144Z",
  "dispatch_id": "DSP-9381a25f9e3f12266115",
  "estimated_minutes": 60,
  "job_id": "J001",
  "last_progress_at": null,
  "nonce": "NONCE-5db1d45b719dcbd18b3e",
  "prohibited_actions": [
    "Do not begin later workflow nodes"
  ],
  "protocol_sha256": "be41cdf4f05fc94d330f63b3d9139fe3254e912ab0d983d3b450850018c8486e",
  "recovery_check": "fixes_applied",
  "required_checks": [
    "Validate produced artifacts"
  ],
  "result": {
    "acceptance_evidence": [
      "Temperature-to-color in shader, non-linear flash, scrubbing pauses simulation"
    ],
    "artifacts": [
      {
        "path": "report.md",
        "purpose": "worker report",
        "sha256": "b59233fa217314b931c2ceee4d77c4fe794f8c9aefb150a9966407090400389e"
      },
      {
        "path": "checkpoint.md",
        "purpose": "current checkpoint",
        "sha256": "defecae9ced71607eddedd2632c1f991bce73cd5ac70edf5b111804a0bc468d8"
      },
      {
        "path": "progress.json",
        "purpose": "machine-readable progress",
        "sha256": "368105cbbebfc2dd2622fa0eeab71f5555593251305be5922642fb1d82c37e5d"
      }
    ],
    "blocking_issues": [],
    "checkpoint_sha256": "defecae9ced71607eddedd2632c1f991bce73cd5ac70edf5b111804a0bc468d8",
    "completed_work_units": [
      "fix-issues"
    ],
    "created_at": "2026-07-09T20:22:56.245643Z",
    "dispatch_id": "DSP-9381a25f9e3f12266115",
    "improvement_observations": [],
    "nonce": "NONCE-5db1d45b719dcbd18b3e",
    "proposed_jobs": [],
    "schema_version": 3,
    "status": "completed",
    "summary": "Fixed verification findings"
  },
  "schema_version": 3,
  "session_id": "ses_bootstrap_J001",
  "side_effect_class": "workspace_write",
  "started_at": null,
  "status": "resolved",
  "transport": {},
  "unbounded_override": null,
  "work_units": [
    "fix-issues"
  ],
  "workflow_node_id": "fix-findings",
  "workspace": "C:\\Projects\\BlackholeSim"
}
