{
  "acceptance_criteria": [
    "All findings fixed",
    "Code compiles"
  ],
  "action_id": "ACT-f3ff0346ac0b66359550",
  "allowed_edit_roots": [
    "C:\\Projects\\BlackholeSim"
  ],
  "capabilities": [],
  "checkpoint_policy": [
    "after_discovery",
    "after_each_batch"
  ],
  "checkpoint_sha256": null,
  "contract_revision": 1,
  "created_at": "2026-07-09T20:51:49.890205Z",
  "dispatch_id": "DSP-606e7df8c30ccb4807f7",
  "estimated_minutes": 60,
  "job_id": "J003",
  "last_progress_at": null,
  "nonce": "NONCE-3b653e2fdbbbd907210d",
  "prohibited_actions": [
    "Do not begin later workflow nodes"
  ],
  "protocol_sha256": "be41cdf4f05fc94d330f63b3d9139fe3254e912ab0d983d3b450850018c8486e",
  "recovery_check": "fixes_applied",
  "required_checks": [
    "Validate produced artifacts"
  ],
  "result": {
    "acceptance_evidence": [
      "Implementation verified clean"
    ],
    "artifacts": [
      {
        "path": "report.md",
        "purpose": "worker report",
        "sha256": "bd9827920b6cc5dfccd5f30d0e3689820452d41d2008cf37a573716b1e2a6ef2"
      },
      {
        "path": "checkpoint.md",
        "purpose": "current checkpoint",
        "sha256": "f734c30be7f91ad20771fbbafe298b4786f31598d2dda29e7366f61d5d4c6ff2"
      },
      {
        "path": "progress.json",
        "purpose": "machine-readable progress",
        "sha256": "526602d1b2cff4cfdd57831378b68647bf12ca868ee819922c0ed1ae4d010064"
      }
    ],
    "blocking_issues": [],
    "checkpoint_sha256": "f734c30be7f91ad20771fbbafe298b4786f31598d2dda29e7366f61d5d4c6ff2",
    "completed_work_units": [
      "fix-issues"
    ],
    "created_at": "2026-07-09T20:53:27.830277Z",
    "dispatch_id": "DSP-606e7df8c30ccb4807f7",
    "improvement_observations": [],
    "nonce": "NONCE-3b653e2fdbbbd907210d",
    "proposed_jobs": [],
    "schema_version": 3,
    "status": "completed",
    "summary": "No findings to fix"
  },
  "schema_version": 3,
  "session_id": "ses_bootstrap_J003",
  "side_effect_class": "workspace_write",
  "started_at": null,
  "status": "resolved",
  "transport": {},
  "unbounded_override": null,
  "work_units": [
    "fix-issues"
  ],
  "workflow_node_id": "fix-findings",
  "workspace": "C:\\Projects\\BlackholeSim"
}
