{
  "acceptance_criteria": [
    "Architecture review complete"
  ],
  "action_id": "ACT-24831c3cef7a7b83de19",
  "allowed_edit_roots": [
    "C:\\Projects\\BlackholeSim"
  ],
  "capabilities": [],
  "checkpoint_policy": [
    "after_discovery",
    "after_each_batch"
  ],
  "checkpoint_sha256": null,
  "contract_revision": 1,
  "created_at": "2026-07-09T21:02:54.467542Z",
  "dispatch_id": "DSP-ea481266111bbb972a3f",
  "estimated_minutes": 60,
  "job_id": "J002",
  "last_progress_at": null,
  "nonce": "NONCE-c61db04342efeb4bda91",
  "prohibited_actions": [
    "Do not begin later workflow nodes"
  ],
  "protocol_sha256": "be41cdf4f05fc94d330f63b3d9139fe3254e912ab0d983d3b450850018c8486e",
  "recovery_check": "explore_complete",
  "required_checks": [
    "Validate produced artifacts"
  ],
  "result": {
    "acceptance_evidence": [
      "Review findings documented"
    ],
    "artifacts": [
      {
        "path": "report.md",
        "purpose": "worker report",
        "sha256": "cb8524cee1c830121ceee4d4285a8e8e500c38439c7b4db042ae95a6845ad860"
      },
      {
        "path": "checkpoint.md",
        "purpose": "current checkpoint",
        "sha256": "ae7266b8f5d24b32f3b79288268dec8a735e752f7820be1a7b1dbd1a5b4be9b7"
      },
      {
        "path": "progress.json",
        "purpose": "machine-readable progress",
        "sha256": "ff1073e0ea7a3fa030aaf93a29010baabb46d81cfc44b30483da89fee9dbd2bd"
      }
    ],
    "blocking_issues": [],
    "checkpoint_sha256": "ae7266b8f5d24b32f3b79288268dec8a735e752f7820be1a7b1dbd1a5b4be9b7",
    "completed_work_units": [
      "investigate"
    ],
    "created_at": "2026-07-09T21:10:43.473319Z",
    "dispatch_id": "DSP-ea481266111bbb972a3f",
    "improvement_observations": [],
    "nonce": "NONCE-c61db04342efeb4bda91",
    "proposed_jobs": [],
    "schema_version": 3,
    "status": "completed",
    "summary": "Architecture review complete"
  },
  "schema_version": 3,
  "session_id": "ses_bootstrap_J002",
  "side_effect_class": "read_only",
  "started_at": null,
  "status": "resolved",
  "transport": {},
  "unbounded_override": null,
  "work_units": [
    "investigate"
  ],
  "workflow_node_id": "explore",
  "workspace": "C:\\Projects\\BlackholeSim"
}
