{
  "acceptance_criteria": [
    "Architecture review complete"
  ],
  "action_id": "ACT-da165825cd80df21ceaf",
  "allowed_edit_roots": [
    "C:\\Projects\\BlackholeSim"
  ],
  "capabilities": [],
  "checkpoint_policy": [
    "after_discovery",
    "after_each_batch"
  ],
  "checkpoint_sha256": null,
  "contract_revision": 1,
  "created_at": "2026-07-09T21:12:23.908121Z",
  "dispatch_id": "DSP-5c73a6a14adb6ad23757",
  "estimated_minutes": 60,
  "job_id": "J004",
  "last_progress_at": null,
  "nonce": "NONCE-0827319f1394458477bf",
  "prohibited_actions": [
    "Do not begin later workflow nodes"
  ],
  "protocol_sha256": "be41cdf4f05fc94d330f63b3d9139fe3254e912ab0d983d3b450850018c8486e",
  "recovery_check": "explore_complete",
  "required_checks": [
    "Validate produced artifacts"
  ],
  "result": {
    "acceptance_evidence": [
      "Review complete. Report written to report.md"
    ],
    "artifacts": [
      {
        "path": "report.md",
        "purpose": "worker report",
        "sha256": "31456fdd2f649b67ccf196af962172f9c9c3956ea10b4967dc09e10b527d87ec"
      },
      {
        "path": "checkpoint.md",
        "purpose": "current checkpoint",
        "sha256": "863ac2b27b55616a4ef261b5c9195b78b5990a1e4c6f5d586de57abf356bf668"
      },
      {
        "path": "progress.json",
        "purpose": "machine-readable progress",
        "sha256": "e19f39a222eeccc2a5d98450e92d5257e8efed628ceabe2b61fc2236369442e4"
      }
    ],
    "blocking_issues": [],
    "checkpoint_sha256": "863ac2b27b55616a4ef261b5c9195b78b5990a1e4c6f5d586de57abf356bf668",
    "completed_work_units": [
      "investigate"
    ],
    "created_at": "2026-07-09T21:18:24.398893Z",
    "dispatch_id": "DSP-5c73a6a14adb6ad23757",
    "improvement_observations": [],
    "nonce": "NONCE-0827319f1394458477bf",
    "proposed_jobs": [],
    "schema_version": 3,
    "status": "completed",
    "summary": "Architecture review complete. The audio-polish-04 implementation is well-architected with clear separation of concerns, consistent patterns, and good documentation. All core audio systems (AudioEngine, SpacetimeHum, GWSound, EventSounds, SpatialAudio) are properly implemented with correct Web Audio API usage. Touch controls, loading screen, cinematic post-processing, error handling, and accessibility are all well implemented. Minor issues include missing post-processing effects (motion blur, lens flare, DOF) and camera velocity not being passed to spatial audio for Doppler effect."
  },
  "schema_version": 3,
  "session_id": "ses_bootstrap_J004",
  "side_effect_class": "read_only",
  "started_at": null,
  "status": "resolved",
  "transport": {},
  "unbounded_override": null,
  "work_units": [
    "investigate"
  ],
  "workflow_node_id": "explore",
  "workspace": "C:\\Projects\\BlackholeSim"
}
