{
  "acceptance_criteria": [
    "Change archived successfully"
  ],
  "action_id": "ACT-2b94980568a1078af33c",
  "allowed_edit_roots": [
    "C:\\Projects\\BlackholeSim"
  ],
  "capabilities": [],
  "checkpoint_policy": [
    "after_discovery",
    "after_each_batch"
  ],
  "checkpoint_sha256": null,
  "contract_revision": 1,
  "created_at": "2026-07-09T20:57:24.294878Z",
  "dispatch_id": "DSP-f3a46592e5aecd545cca",
  "estimated_minutes": 60,
  "job_id": "J003",
  "last_progress_at": null,
  "nonce": "NONCE-9cae7b5004c23e19fe48",
  "prohibited_actions": [
    "Do not begin later workflow nodes"
  ],
  "protocol_sha256": "be41cdf4f05fc94d330f63b3d9139fe3254e912ab0d983d3b450850018c8486e",
  "recovery_check": "change_archived",
  "required_checks": [
    "Validate produced artifacts"
  ],
  "result": {
    "acceptance_evidence": [
      "audio-polish-04 archived"
    ],
    "artifacts": [
      {
        "path": "report.md",
        "purpose": "worker report",
        "sha256": "bd9827920b6cc5dfccd5f30d0e3689820452d41d2008cf37a573716b1e2a6ef2"
      },
      {
        "path": "checkpoint.md",
        "purpose": "current checkpoint",
        "sha256": "029b81ef15c5e894a8ec1b33695649245634725d7024be501111490d3f6d59a0"
      },
      {
        "path": "progress.json",
        "purpose": "machine-readable progress",
        "sha256": "ba98a2f5c8e388f078d37586b13f96238cf331ab30eebc000135f492b61f8f8c"
      }
    ],
    "blocking_issues": [],
    "checkpoint_sha256": "029b81ef15c5e894a8ec1b33695649245634725d7024be501111490d3f6d59a0",
    "completed_work_units": [
      "archive"
    ],
    "created_at": "2026-07-09T20:59:15.487637Z",
    "dispatch_id": "DSP-f3a46592e5aecd545cca",
    "improvement_observations": [],
    "nonce": "NONCE-9cae7b5004c23e19fe48",
    "proposed_jobs": [],
    "schema_version": 3,
    "status": "completed",
    "summary": "Change archived"
  },
  "schema_version": 3,
  "session_id": "ses_bootstrap_J003",
  "side_effect_class": "workspace_write",
  "started_at": null,
  "status": "resolved",
  "transport": {},
  "unbounded_override": null,
  "work_units": [
    "archive"
  ],
  "workflow_node_id": "archive",
  "workspace": "C:\\Projects\\BlackholeSim"
}
