{
  "acceptance_criteria": [
    "All task groups implemented",
    "Code compiles"
  ],
  "action_id": "ACT-442524761034a24f4bba",
  "allowed_edit_roots": [
    "C:\\Projects\\BlackholeSim"
  ],
  "capabilities": [],
  "checkpoint_policy": [
    "after_discovery",
    "after_each_batch"
  ],
  "checkpoint_sha256": null,
  "contract_revision": 1,
  "created_at": "2026-07-09T20:36:45.017807Z",
  "dispatch_id": "DSP-907896cd098a49edd974",
  "estimated_minutes": 60,
  "job_id": "J003",
  "last_progress_at": null,
  "nonce": "NONCE-f50955fe297919ae1d10",
  "prohibited_actions": [
    "Do not begin later workflow nodes"
  ],
  "protocol_sha256": "be41cdf4f05fc94d330f63b3d9139fe3254e912ab0d983d3b450850018c8486e",
  "recovery_check": "tasks_applied",
  "required_checks": [
    "Validate produced artifacts"
  ],
  "result": {
    "acceptance_evidence": [
      "Audio, touch, loading, post-processing, error handling, accessibility implemented"
    ],
    "artifacts": [
      {
        "path": "report.md",
        "purpose": "worker report",
        "sha256": "bd9827920b6cc5dfccd5f30d0e3689820452d41d2008cf37a573716b1e2a6ef2"
      },
      {
        "path": "checkpoint.md",
        "purpose": "current checkpoint",
        "sha256": "b7f822163ca791a26f5b19772ada96487e0c5cd78bea83d88184a48f171a41a1"
      },
      {
        "path": "progress.json",
        "purpose": "machine-readable progress",
        "sha256": "d31f78f9ec0efe0cef5f7c19e0dd0cd9494738770ae86f69d7c2d24736ec08dc"
      }
    ],
    "blocking_issues": [],
    "checkpoint_sha256": "b7f822163ca791a26f5b19772ada96487e0c5cd78bea83d88184a48f171a41a1",
    "completed_work_units": [
      "apply-all"
    ],
    "created_at": "2026-07-09T20:46:24.872596Z",
    "dispatch_id": "DSP-907896cd098a49edd974",
    "improvement_observations": [],
    "nonce": "NONCE-f50955fe297919ae1d10",
    "proposed_jobs": [],
    "schema_version": 3,
    "status": "completed",
    "summary": "All audio-polish-04 tasks implemented"
  },
  "schema_version": 3,
  "session_id": "ses_bootstrap_J003",
  "side_effect_class": "workspace_write",
  "started_at": null,
  "status": "resolved",
  "transport": {},
  "unbounded_override": null,
  "work_units": [
    "apply-all"
  ],
  "workflow_node_id": "apply-tasks",
  "workspace": "C:\\Projects\\BlackholeSim"
}
