{
  "acceptance_criteria": [
    "Change archived successfully"
  ],
  "action_id": "ACT-7130b51a700a0fd6288c",
  "allowed_edit_roots": [
    "C:\\Projects\\BlackholeSim"
  ],
  "capabilities": [],
  "checkpoint_policy": [
    "after_discovery",
    "after_each_batch"
  ],
  "checkpoint_sha256": null,
  "contract_revision": 1,
  "created_at": "2026-07-09T20:28:39.516838Z",
  "dispatch_id": "DSP-52e8ce011ccf58a70ab9",
  "estimated_minutes": 60,
  "job_id": "J001",
  "last_progress_at": null,
  "nonce": "NONCE-edea07504fdf2192d204",
  "prohibited_actions": [
    "Do not begin later workflow nodes"
  ],
  "protocol_sha256": "be41cdf4f05fc94d330f63b3d9139fe3254e912ab0d983d3b450850018c8486e",
  "recovery_check": "change_archived",
  "required_checks": [
    "Validate produced artifacts"
  ],
  "result": {
    "acceptance_evidence": [
      "visual-effects-03 archived"
    ],
    "artifacts": [
      {
        "path": "report.md",
        "purpose": "worker report",
        "sha256": "b59233fa217314b931c2ceee4d77c4fe794f8c9aefb150a9966407090400389e"
      },
      {
        "path": "checkpoint.md",
        "purpose": "current checkpoint",
        "sha256": "bf802feaba0da7a3a67a591e349e3c3408a777cde27f3276eb425658c7b9b592"
      },
      {
        "path": "progress.json",
        "purpose": "machine-readable progress",
        "sha256": "32cd19761f4db4483ccddcbd83cbcf457c2dd84e83a50c70dcd1f635ec662b4c"
      }
    ],
    "blocking_issues": [],
    "checkpoint_sha256": "bf802feaba0da7a3a67a591e349e3c3408a777cde27f3276eb425658c7b9b592",
    "completed_work_units": [
      "archive"
    ],
    "created_at": "2026-07-09T20:33:05.800672Z",
    "dispatch_id": "DSP-52e8ce011ccf58a70ab9",
    "improvement_observations": [],
    "nonce": "NONCE-edea07504fdf2192d204",
    "proposed_jobs": [],
    "schema_version": 3,
    "status": "completed",
    "summary": "Change archived"
  },
  "schema_version": 3,
  "session_id": "ses_bootstrap_J001",
  "side_effect_class": "workspace_write",
  "started_at": null,
  "status": "resolved",
  "transport": {},
  "unbounded_override": null,
  "work_units": [
    "archive"
  ],
  "workflow_node_id": "archive",
  "workspace": "C:\\Projects\\BlackholeSim"
}
