{
  "acceptance_criteria": [
    "Delta specs merged into main specs"
  ],
  "action_id": "ACT-8d0cf43f76ec0ef51473",
  "allowed_edit_roots": [
    "C:\\Projects\\BlackholeSim"
  ],
  "capabilities": [],
  "checkpoint_policy": [
    "after_discovery",
    "after_each_batch"
  ],
  "checkpoint_sha256": null,
  "contract_revision": 1,
  "created_at": "2026-07-09T20:23:49.934279Z",
  "dispatch_id": "DSP-e3e6caffaddd2175455a",
  "estimated_minutes": 60,
  "job_id": "J001",
  "last_progress_at": null,
  "nonce": "NONCE-97dc72ba0b66ac9f42e4",
  "prohibited_actions": [
    "Do not begin later workflow nodes"
  ],
  "protocol_sha256": "be41cdf4f05fc94d330f63b3d9139fe3254e912ab0d983d3b450850018c8486e",
  "recovery_check": "specs_synced",
  "required_checks": [
    "Validate produced artifacts"
  ],
  "result": {
    "acceptance_evidence": [
      "Delta specs merged to main"
    ],
    "artifacts": [
      {
        "path": "report.md",
        "purpose": "worker report",
        "sha256": "b59233fa217314b931c2ceee4d77c4fe794f8c9aefb150a9966407090400389e"
      },
      {
        "path": "checkpoint.md",
        "purpose": "current checkpoint",
        "sha256": "9bab98d1dd3163c626845a01473e44232daf1b6697ab7f741428bef5cd9731f1"
      }
    ],
    "blocking_issues": [],
    "checkpoint_sha256": "9bab98d1dd3163c626845a01473e44232daf1b6697ab7f741428bef5cd9731f1",
    "completed_work_units": [
      "sync"
    ],
    "created_at": "2026-07-09T20:27:12.206462Z",
    "dispatch_id": "DSP-e3e6caffaddd2175455a",
    "improvement_observations": [],
    "nonce": "NONCE-97dc72ba0b66ac9f42e4",
    "proposed_jobs": [],
    "schema_version": 3,
    "status": "completed",
    "summary": "Specs synced"
  },
  "schema_version": 3,
  "session_id": "ses_bootstrap_J001",
  "side_effect_class": "workspace_write",
  "started_at": null,
  "status": "resolved",
  "transport": {},
  "unbounded_override": null,
  "work_units": [
    "sync"
  ],
  "workflow_node_id": "sync-specs",
  "workspace": "C:\\Projects\\BlackholeSim"
}
